<EShopHierarchy xmlns:xsi="http://www.w3.org/2001/XMLSchema-instance" 
                xsi:noNamespaceSchemaLocation="./../schemas/schema-1.xsd">
  
  <Owner>
    <Name xml:lang="en">Goth Corp</Name>
    <CompanyID>FR33Z3</CompanyID>
    <EShop>
      <Name xml:lang="en">Goth Fridges</Name>
      <URL>https://www.gothcorp.com/shop/fridges</URL>
      <Icon>https://example.org/images/fridge.png</Icon>
      <Account>
        <Login xml:lang="en">Boyoyoyle</Login>
        <Password>nothing2c</Password>
        <Cart>
          <ItemCount>1</ItemCount>
          <TotalPrice>999.99</TotalPrice>
        </Cart>
      </Account>
    </EShop>
  </Owner>

  <Owner>
    <Name xml:lang="en">Wayne Enterprises</Name>
    <CompanyID>8UTTL3R</CompanyID>
    <EShop>
      <Name xml:lang="en">Wayne's Gains</Name>
      <URL>https://www.waynesgains.com</URL>
      <Icon>https://example.org/images/protein.png</Icon>
      <Account>
        <Login xml:lang="en">BatMan4Ever</Login>
        <Password>AlfredDaButtler</Password>
        <Cart>
          <ItemCount>1</ItemCount>
          <TotalPrice>50.49</TotalPrice>
        </Cart>
      </Account>
    </EShop>
  </Owner>

  <Owner>
    <Name xml:lang="en">Lex Crop</Name>
    <CompanyID>HAT3R_1</CompanyID>
    <EShop>
      <Name xml:lang="en">Lex Rides</Name>
      <URL>https://www.lexcorp.com/vehicles/shop</URL>
      <Icon>https://example.org/images/car.png</Icon>
      <Account>
        <Login xml:lang="en">SuperLoser</Login>
        <Password>1a1a1A</Password>
        <Cart>
          <ItemCount>1</ItemCount>
          <TotalPrice>10024.99</TotalPrice>
        </Cart>
      </Account>
    </EShop>
  </Owner>

</EShopHierarchy>
